{
  "claims": [
    {
      "claim_category": "dataset",
      "claim_id": "MGP_DATASET_N",
      "claim_text": "MGP-6 v4.3 contains 900 items.",
      "configuration_id": "mgp6-v43-frozen-hidden",
      "evidence_source": "benchmarks/mgp6/mgp6_v4_3/public/SPLIT_SUMMARY.json",
      "expected_value": 900,
      "generating_script": "scripts/claims/build_claim_ledger.py",
      "locator": "Section 4.1",
      "manuscript_file": "paper/paper_1/main.tex",
      "notes": "",
      "observed_value": 900,
      "reproduction_command": ".venv/bin/python scripts/claims/build_claim_ledger.py",
      "source_artifact_path": "benchmarks/mgp6/mgp6_v4_3/public/SPLIT_SUMMARY.json",
      "source_artifact_sha256": "ac7bae8244470a34b611a909e7cfe31741771e70010eaf0e358cf7e5bcfa4f9b",
      "statistical_method": "manifest count",
      "status": "verified",
      "tolerance": 0.0,
      "verification_timestamp": "2026-08-02T20:22:05.243143+00:00"
    },
    {
      "claim_category": "dataset",
      "claim_id": "MGP_COMPONENT_N",
      "claim_text": "MGP-6 v4.3 contains 100 semantic components.",
      "configuration_id": "mgp6-v43-frozen-hidden",
      "evidence_source": "benchmarks/mgp6/mgp6_v4_3/public/SPLIT_SUMMARY.json",
      "expected_value": 100,
      "generating_script": "scripts/claims/build_claim_ledger.py",
      "locator": "Section 4.1",
      "manuscript_file": "paper/paper_1/main.tex",
      "notes": "",
      "observed_value": 100,
      "reproduction_command": ".venv/bin/python scripts/claims/build_claim_ledger.py",
      "source_artifact_path": "benchmarks/mgp6/mgp6_v4_3/public/SPLIT_SUMMARY.json",
      "source_artifact_sha256": "ac7bae8244470a34b611a909e7cfe31741771e70010eaf0e358cf7e5bcfa4f9b",
      "statistical_method": "manifest count",
      "status": "verified",
      "tolerance": 0.0,
      "verification_timestamp": "2026-08-02T20:22:05.243143+00:00"
    },
    {
      "claim_category": "dataset",
      "claim_id": "MGP_SPLITS",
      "claim_text": "Train, development, and hidden contain 180, 180, and 540 items.",
      "configuration_id": "mgp6-v43-frozen-hidden",
      "evidence_source": "benchmarks/mgp6/mgp6_v4_3/public/SPLIT_SUMMARY.json",
      "expected_value": {
        "dev": 180,
        "hidden": 540,
        "train": 180
      },
      "generating_script": "scripts/claims/build_claim_ledger.py",
      "locator": "Section 4.1",
      "manuscript_file": "paper/paper_1/main.tex",
      "notes": "",
      "observed_value": {
        "dev": 180,
        "hidden": 540,
        "train": 180
      },
      "reproduction_command": ".venv/bin/python scripts/claims/build_claim_ledger.py",
      "source_artifact_path": "benchmarks/mgp6/mgp6_v4_3/public/SPLIT_SUMMARY.json",
      "source_artifact_sha256": "ac7bae8244470a34b611a909e7cfe31741771e70010eaf0e358cf7e5bcfa4f9b",
      "statistical_method": "manifest count",
      "status": "verified",
      "tolerance": 0.0,
      "verification_timestamp": "2026-08-02T20:22:05.243143+00:00"
    },
    {
      "claim_category": "dataset",
      "claim_id": "MGP_HIDDEN_BALANCE",
      "claim_text": "The hidden split has 180 items per action.",
      "configuration_id": "mgp6-v43-frozen-hidden",
      "evidence_source": "benchmarks/mgp6/mgp6_v4_3/public/SPLIT_SUMMARY.json",
      "expected_value": {
        "ABSTAIN": 180,
        "KEEP": 180,
        "SUPERSEDE": 180
      },
      "generating_script": "scripts/claims/build_claim_ledger.py",
      "locator": "Section 7.1",
      "manuscript_file": "paper/paper_1/main.tex",
      "notes": "",
      "observed_value": {
        "ABSTAIN": 180,
        "KEEP": 180,
        "SUPERSEDE": 180
      },
      "reproduction_command": ".venv/bin/python scripts/claims/build_claim_ledger.py",
      "source_artifact_path": "benchmarks/mgp6/mgp6_v4_3/public/SPLIT_SUMMARY.json",
      "source_artifact_sha256": "ac7bae8244470a34b611a909e7cfe31741771e70010eaf0e358cf7e5bcfa4f9b",
      "statistical_method": "class count",
      "status": "verified",
      "tolerance": 0.0,
      "verification_timestamp": "2026-08-02T20:22:05.243143+00:00"
    },
    {
      "claim_category": "metric",
      "claim_id": "MGP_ACCURACY",
      "claim_text": "Frozen hidden action accuracy is 0.8481.",
      "configuration_id": "mgp6-v43-frozen-hidden",
      "evidence_source": "runs/mgp6_v43/final_hidden/live_model_controller_qwen35_9b/predictions.jsonl",
      "expected_value": 0.8481481481481481,
      "generating_script": "scripts/claims/build_claim_ledger.py",
      "locator": "Abstract; Table 1",
      "manuscript_file": "paper/paper_1/main.tex",
      "notes": "",
      "observed_value": 0.8481481481481481,
      "reproduction_command": ".venv/bin/python .private/benchmarks/mgp6/v4.3/hidden_gold/evaluate_predictions.py .private/benchmarks/mgp6/v4.3/hidden_gold/hidden_gold.jsonl runs/mgp6_v43/final_hidden/live_model_controller_qwen35_9b/predictions.jsonl",
      "source_artifact_path": "runs/mgp6_v43/final_hidden/live_model_controller_qwen35_9b/predictions.jsonl",
      "source_artifact_sha256": "e6a598799115c9fc80ae3e731f1b5d59a4947e48df5356b12ba518bafb846806",
      "statistical_method": "accuracy",
      "status": "verified",
      "tolerance": 1e-12,
      "verification_timestamp": "2026-08-02T20:22:05.243143+00:00"
    },
    {
      "claim_category": "metric",
      "claim_id": "MGP_MACRO_F1",
      "claim_text": "Frozen hidden macro-F1 is 0.8479.",
      "configuration_id": "mgp6-v43-frozen-hidden",
      "evidence_source": "runs/mgp6_v43/final_hidden/live_model_controller_qwen35_9b/predictions.jsonl",
      "expected_value": 0.847872957121512,
      "generating_script": "scripts/claims/build_claim_ledger.py",
      "locator": "Abstract; Table 1",
      "manuscript_file": "paper/paper_1/main.tex",
      "notes": "",
      "observed_value": 0.847872957121512,
      "reproduction_command": ".venv/bin/python .private/benchmarks/mgp6/v4.3/hidden_gold/evaluate_predictions.py .private/benchmarks/mgp6/v4.3/hidden_gold/hidden_gold.jsonl runs/mgp6_v43/final_hidden/live_model_controller_qwen35_9b/predictions.jsonl",
      "source_artifact_path": "runs/mgp6_v43/final_hidden/live_model_controller_qwen35_9b/predictions.jsonl",
      "source_artifact_sha256": "e6a598799115c9fc80ae3e731f1b5d59a4947e48df5356b12ba518bafb846806",
      "statistical_method": "unweighted per-action macro-F1",
      "status": "verified",
      "tolerance": 1e-12,
      "verification_timestamp": "2026-08-02T20:22:05.243143+00:00"
    },
    {
      "claim_category": "uncertainty",
      "claim_id": "MGP_CLUSTER_CI_ACCURACY",
      "claim_text": "Component-cluster 95% accuracy interval is [0.8037, 0.8889].",
      "configuration_id": "mgp6-v43-frozen-hidden",
      "evidence_source": "runs/mgp6_v43/final_hidden/live_model_controller_qwen35_9b/predictions.jsonl",
      "expected_value": [
        0.8037037037037037,
        0.8888888888888888
      ],
      "generating_script": "scripts/claims/build_claim_ledger.py",
      "locator": "Table 1",
      "manuscript_file": "paper/paper_1/main.tex",
      "notes": "",
      "observed_value": [
        0.8037037037037037,
        0.8888888888888888
      ],
      "reproduction_command": ".venv/bin/python .private/benchmarks/mgp6/v4.3/hidden_gold/evaluate_predictions.py .private/benchmarks/mgp6/v4.3/hidden_gold/hidden_gold.jsonl runs/mgp6_v43/final_hidden/live_model_controller_qwen35_9b/predictions.jsonl",
      "source_artifact_path": "runs/mgp6_v43/final_hidden/live_model_controller_qwen35_9b/predictions.jsonl",
      "source_artifact_sha256": "e6a598799115c9fc80ae3e731f1b5d59a4947e48df5356b12ba518bafb846806",
      "statistical_method": "5,000-replicate component bootstrap, seed 4301",
      "status": "verified",
      "tolerance": 1e-12,
      "verification_timestamp": "2026-08-02T20:22:05.243143+00:00"
    },
    {
      "claim_category": "uncertainty",
      "claim_id": "MGP_CLUSTER_CI_F1",
      "claim_text": "Component-cluster 95% macro-F1 interval is [0.8021, 0.8894].",
      "configuration_id": "mgp6-v43-frozen-hidden",
      "evidence_source": "runs/mgp6_v43/final_hidden/live_model_controller_qwen35_9b/predictions.jsonl",
      "expected_value": [
        0.8020749634748688,
        0.889351432442434
      ],
      "generating_script": "scripts/claims/build_claim_ledger.py",
      "locator": "Table 1",
      "manuscript_file": "paper/paper_1/main.tex",
      "notes": "",
      "observed_value": [
        0.8020749634748688,
        0.889351432442434
      ],
      "reproduction_command": ".venv/bin/python .private/benchmarks/mgp6/v4.3/hidden_gold/evaluate_predictions.py .private/benchmarks/mgp6/v4.3/hidden_gold/hidden_gold.jsonl runs/mgp6_v43/final_hidden/live_model_controller_qwen35_9b/predictions.jsonl",
      "source_artifact_path": "runs/mgp6_v43/final_hidden/live_model_controller_qwen35_9b/predictions.jsonl",
      "source_artifact_sha256": "e6a598799115c9fc80ae3e731f1b5d59a4947e48df5356b12ba518bafb846806",
      "statistical_method": "5,000-replicate component bootstrap, seed 4301",
      "status": "verified",
      "tolerance": 1e-12,
      "verification_timestamp": "2026-08-02T20:22:05.243143+00:00"
    },
    {
      "claim_category": "metric",
      "claim_id": "MGP_CONFUSION",
      "claim_text": "The hidden confusion matrix is 142/30/8, 18/151/11, 6/9/165.",
      "configuration_id": "mgp6-v43-frozen-hidden",
      "evidence_source": "runs/mgp6_v43/final_hidden/live_model_controller_qwen35_9b/predictions.jsonl",
      "expected_value": {
        "ABSTAIN": {
          "ABSTAIN": 142,
          "KEEP": 30,
          "SUPERSEDE": 8
        },
        "KEEP": {
          "ABSTAIN": 18,
          "KEEP": 151,
          "SUPERSEDE": 11
        },
        "SUPERSEDE": {
          "ABSTAIN": 6,
          "KEEP": 9,
          "SUPERSEDE": 165
        }
      },
      "generating_script": "scripts/claims/build_claim_ledger.py",
      "locator": "Table 2",
      "manuscript_file": "paper/paper_1/main.tex",